{
  "name": "Real Estate Agency Client Interaction",
  "states": [
    {
      "name": "Start"
    },
    {
      "name": "InitialContact"
    },
    {
      "name": "Qualification"
    },
    {
      "name": "PropertySearch"
    },
    {
      "name": "PropertyViewing"
    },
    {
      "name": "OfferNegotiation"
    },
    {
      "name": "ContractSigning"
    },
    {
      "name": "DealClosed"
    },
    {
      "name": "ClientExit"
    }
  ],
  "transitions": [
    {
      "source": "Start",
      "target": "InitialContact",
      "event": "ClientInquires",
      "condition": null
    },
    {
      "source": "InitialContact",
      "target": "Qualification",
      "event": "AgentQualifiesClient",
      "condition": null
    },
    {
      "source": "Qualification",
      "target": "PropertySearch",
      "event": "StartPropertySearch",
      "condition": null
    },
    {
      "source": "PropertySearch",
      "target": "PropertyViewing",
      "event": "PropertyFound",
      "condition": "SearchProperty::class"
    },
    {
      "source": "PropertySearch",
      "target": "ClientExit",
      "event": "NoSuitablePropertyFound",
      "condition": null
    },
    {
      "source": "PropertyViewing",
      "target": "OfferNegotiation",
      "event": "ClientInterested",
      "condition": null
    },
    {
      "source": "PropertyViewing",
      "target": "ClientExit",
      "event": "SuccessfulNegotiation",
      "condition": null
    },
    {
      "source": "OfferNegotiation",
      "target": "ContractSigning",
      "event": "SuccessfulNegotiation",
      "condition": null
    },
    {
      "source": "ContractSigning",
      "target": "DealClosed",
      "event": "DealCompleted",
      "condition": null
    }
  ],
  "events": [
    {
      "name": "ClientInquires",
      "command": null
    },
    {
      "name": "AgentQualifiesClient",
      "command": null
    },
    {
      "name": "StartPropertySearch",
      "command": null
    },
    {
      "name": "PropertyFound",
      "command": null
    },
    {
      "name": "SuccessfulNegotiation",
      "command": null
    },
    {
      "name": "DealCompleted",
      "command": null
    },
    {
      "name": "ClientInterested",
      "command": null
    },
    {
      "name": "NoSuitablePropertyFound",
      "command": null
    },
    {
      "name": "ClientDeclinesOffer",
      "command": null
    },
    {
      "name": "ClientWalksAway",
      "command": null
    }
  ]
}