{
  "name": "State machine name with 3 states",
  "states": [
    {
      "name": "S1"
    },
    {
      "name": "S2"
    },
    {
      "name": "S3"
    }
  ],
  "transitions": [
    {
      "source": "S1",
      "target": "S2",
      "event": "EV1",
      "condition": null
    },
    {
      "source": "S2",
      "target": "S3",
      "event": "EV2",
      "condition": null
    }
  ],
  "events": [
    {
      "name": "EV1",
      "command": null
    },
    {
      "name": "EV2",
      "command": null
    }
  ]
}
