{
  "name": "State machine name",
  "states": [
    {
      "name": "New"
    },
    {
      "name": "Created"
    },
    {
      "name": "PendingPayment"
    },
    {
      "name": "CheckPayment"
    },
    {
      "name": "Cancelled"
    },
    {
      "name": "PaymentAuthorized"
    },
    {
      "name": "PaymentFailed"
    },
    {
      "name": "PreparingShipment"
    },
    {
      "name": "ShipmentReady"
    },
    {
      "name": "Invoicing"
    },
    {
      "name": "Shipped"
    },
    {
      "name": "Delivered"
    },
    {
      "name": "Completed"
    }
  ],
  "transitions": [
    {
      "source": "New",
      "target": "Created",
      "event": "Create Order",
      "condition": "Tlab\\StateMachine\\Conditions\\SampleCondition"
    },
    {
      "source": "Created",
      "target": "PendingPayment",
      "event": "Start Payment Process",
      "condition": null
    },
    {
      "source": "PendingPayment",
      "target": "CheckPayment",
      "event": "Check Payment Status",
      "condition": null
    },
    {
      "source": "CheckPayment",
      "target": "PaymentAuthorized",
      "event": "Payment OK",
      "condition": null
    },
    {
      "source": "CheckPayment",
      "target": "PaymentFailed",
      "event": "Payment Not OK",
      "condition": null
    },
    {
      "source": "PaymentFailed",
      "target": "Cancelled",
      "event": "Order Cancelled",
      "condition": null
    },
    {
      "source": "PaymentAuthorized",
      "target": "PreparingShipment",
      "event": "Start Shipment Preparation",
      "condition": null
    },
    {
      "source": "PreparingShipment",
      "target": "ShipmentReady",
      "event": "Shipment Prepared",
      "condition": null
    },
    {
      "source": "ShipmentReady",
      "target": "Invoicing",
      "event": "Generate Invoice",
      "condition": null
    },
    {
      "source": "Invoicing",
      "target": "Shipped",
      "event": "Shipment Dispatched",
      "condition": null
    },
    {
      "source": "Shipped",
      "target": "Delivered",
      "event": "Shipment Delivered",
      "condition": null
    },
    {
      "source": "Delivered",
      "target": "Completed",
      "event": "Complete Order",
      "condition": null
    }
  ],
  "events": [
    {
      "name": "Create Order",
      "command": "Tlab\\StateMachine\\Commands\\SampleCommand"
    },
    {
      "name": "Start Payment Process",
      "command": null
    },
    {
      "name": "Check Payment Status",
      "command": null
    },
    {
      "name": "Payment OK",
      "command": null
    },
    {
      "name": "Payment Not OK",
      "command": null
    },
    {
      "name": "Order Cancelled",
      "command": null
    },
    {
      "name": "Start Shipment Preparation",
      "command": null
    },
    {
      "name": "Shipment Prepared",
      "command": null
    },
    {
      "name": "Generate Invoice",
      "command": null
    },
    {
      "name": "Shipment Dispatched",
      "command": null
    },
    {
      "name": "Shipment Delivered",
      "command": null
    },
    {
      "name": "Complete Order",
      "command": null
    }
  ]
}
